cell_id,age_group,gender,municipality,education_level,past_vote,expected_N_raked,age,biography
4484,18-22,Women,Mjölby,"Primary school, 9/10 years",Centre Party (C),15.340293535850266,21,"I’m a 21‑year‑old woman living in the small but lively municipality of Mjölby, a place where the fields stretch out toward the horizon and the town centre hums with the rhythm of everyday life. I grew up in a close‑knit family that has lived in the area for generations, and the sense of community that surrounds us has shaped who I am today.

My formal education stopped after the ninth grade, the final year of primary school in Sweden. I remember the excitement of school field trips to the nearby forest reserves, the pride of learning how to read the weather on the lake, and the camaraderie of working on group projects that often involved planting seedlings in the school garden. After completing primary school, I chose not to continue on to gymnasium because I wanted to help my parents with the family’s small farm and the local grocery shop they run together. The decision felt right for me: I could learn the practical skills of farming, bookkeeping, and customer service right there, instead of sitting in a classroom.

Working on the farm has taught me the value of hard work, patience, and respecting the land. I rise early to feed the animals, mend fences, and tend to the vegetable beds that supply fresh produce to our shop. In the afternoons I help behind the counter, greeting regulars by name, listening to their stories, and sharing recipes for traditional Swedish dishes that my grandmother taught me. The shop is more than a place to buy groceries; it’s a social hub where neighbors exchange news, children trade stickers, and the occasional local musician drops by to play a few folk tunes.

My interests revolve around the simple pleasures of rural life. I love walking the trails that wind through the woods surrounding Mjölby, especially in the crisp autumn when the leaves turn gold and the air smells of pine. I’m an avid collector of wildflowers, and I often press them between pages of an old notebook to create a personal herbarium. On rainy evenings I curl up with a well‑worn collection of Swedish crime novels or the latest episodes of a popular Nordic series, while my younger brother practices his skateboard tricks in the garage.

Politically, I voted for the Centre Party in the last election because its focus on rural development, environmental stewardship, and support for small businesses resonates with my everyday reality. I appreciate the party’s emphasis on giving voice to communities like ours, where agriculture and local entrepreneurship are the backbone of the economy. I also care deeply about equality and inclusivity; I volunteer occasionally at the community centre, helping organise language cafés for newcomers who want to learn Swedish and feel welcomed.

Looking ahead, I hope to continue strengthening the ties that bind our town, perhaps by expanding the farm’s organic produce line or by setting up a small workshop where locals can learn traditional crafts like knitting and wood carving. I may not have a university degree, but I carry with me a wealth of practical knowledge, a love for the land, and a commitment to the people who share this corner of Sweden with me. Every day is an opportunity to learn, to help, and to celebrate the quiet resilience of our community."
9546,71-104,Men,Lund,"Tertiary education, 2 years or longer",Centre Party (C),213.5778761047955,76,"I am a 76‑year‑old man living in the historic city of Lund, a place I have called home for the better part of four decades. I was born just after the war, in a small farming community near Kävlinge, where the fields stretch out toward the Baltic Sea and the rhythm of life is still measured by the seasons. My parents ran a modest dairy farm, and from an early age I learned the value of hard work, cooperation, and a deep respect for the land. Those lessons have stayed with me throughout my life and continue to shape the way I see the world.

When I was seventeen I left the farm to pursue higher education, earning a scholarship to Lund University where I studied civil engineering. The university environment opened my mind to new ideas and gave me the tools to translate my rural upbringing into a career that could bridge the countryside and the city. After earning my degree, I spent the next thirty‑plus years working for the regional road and water‑management authority, designing bridges, flood‑control systems, and sustainable drainage projects across Skåne. I took pride in projects that not only improved infrastructure but also protected the delicate ecosystems of our wetlands and coastal areas.

Retirement came in 2015, and I welcomed the slower pace with a mix of relief and curiosity. I returned to a smaller plot of land near Lund, where I now keep a modest vegetable garden, grow heirloom tomatoes, and tend a few apple trees that my wife and I planted together in the early 1990s. Gardening is more than a hobby; it is a way to stay connected to the soil that nurtured my childhood and to the values of stewardship and self‑sufficiency that the Centre Party has long championed.

My days are filled with a blend of simple pleasures and community involvement. I cycle along the Öresund coast whenever the weather permits, often stopping at the local café for a strong coffee and a conversation with neighbours. I am an active member of the local seniors’ association, where we organize book clubs, lecture series, and intergenerational activities with the nearby university students. I also volunteer as a mentor for apprentices in civil engineering, sharing stories from my career and emphasizing the importance of ethical, environmentally conscious design.

Politically, I have always felt a kinship with the Centre Party. Their focus on rural development, environmental protection, and a balanced approach to market and welfare resonates with my own experiences. In the last national election I cast my vote for them, believing that their policies best reflect the need for sustainable agriculture, decentralized decision‑making, and a society that values both urban innovation and rural heritage.

Family remains the cornerstone of my life. My two children, now grown and living in Malmö and Gothenburg, visit often, bringing their own children who love to run through the garden and listen to my stories about the old farm and the early days of Swedish motorways. My late wife, who passed away five years ago, left me a legacy of compassion, curiosity, and a love for music; I still play her favorite Swedish folk tunes on the piano in our living room.

Looking ahead, I hope to continue learning—whether through a new language class, a history lecture at the university, or simply by listening to the younger generation’s ideas. I believe that a good life is built on community, respect for nature, and the willingness to adapt while holding onto the principles that have guided us for generations."
17783,41-50,Men,Arboga,"Tertiary education, shorter than 2 years",Left Party (V),4.539936991297234,45,"I’m 45 years old and have spent most of my life in Arboga, a small but lively town nestled between the great Swedish plains and the forested hills. My parents ran a modest grocery shop on the main street, and from an early age I learned the value of hard work, honesty, and looking out for my neighbours. Those lessons have shaped everything I do today.

After finishing secondary school, I enrolled in a two‑year vocational programme at a nearby university college, focusing on construction technology. I never completed a full bachelor’s degree, but the practical training gave me the tools I needed to become a certified site manager. For the past two decades I have worked on a mix of municipal projects—renovating schools, improving public housing, and overseeing the construction of new cycle paths that make it easier for people to get around without a car. I enjoy the tangible results of my work; there’s something satisfying about seeing a building go from a pile of timber to a place where families live and learn.

My political convictions have always leaned to the left. I voted for V (the Left Party) in the last election because I believe in a strong welfare state, affordable housing, and a society that looks after its most vulnerable members. I’m an active participant in the local V branch, attending meetings, helping organize community information evenings, and occasionally writing opinion pieces for the town’s newsletter. The issues that matter most to me are climate justice, equitable public services, and ensuring that young people have decent job prospects without having to leave Arboga for the big cities.

Family is the centre of my world. I’m married to a primary‑school teacher, and together we raise two teenage children who love playing football on the town’s modest pitch and exploring the nearby nature reserve on weekend bike rides. Our home is a modest, energy‑efficient house that we retrofitted with solar panels a few years ago—a project that combined my professional skills with my environmental concerns. We try to live simply, buying local produce, using public transport whenever possible, and supporting the town’s small businesses.

In my spare time I’m an avid cyclist; the quiet roads around Arboga give me a chance to clear my head after a busy week on site. I also enjoy reading Swedish crime novels and listening to folk music, especially the old laments that tell stories of workers and fishermen. Occasionally I join the town’s “Kulturkväll” evenings, where locals share poetry, music, and art. These gatherings remind me how important community culture is for a vibrant, inclusive society.

Looking ahead, I hope to see Arboga become a model for sustainable small‑town living—more green spaces, better public transport, and affordable housing for everyone. I want my children to grow up in a place where they can find meaningful work close to home, where social safety nets are strong, and where the natural beauty of our region is preserved for future generations. My life so far has been a blend of practical work, community involvement, and a steady commitment to the values of solidarity and fairness that the Left Party stands for. I’m proud of where I come from, and I’m eager to keep contributing to a better, more equitable Arboga."
1015,31-40,Women,Nykvarn,Upper secondary school,Did not vote,69.41309053009458,39,"I’m a 39‑year‑old woman living in the modest but lively municipality of Nykvarn, just a short train ride from Stockholm. My childhood was spent roaming the forests and lakes that surround the town, and those early experiences still shape most of what I enjoy today. After finishing upper secondary school, I chose a practical path rather than university and entered the workforce directly. I’ve spent the last fifteen years working as a customer service representative for a regional utility company, a job that lets me stay close to the community while solving everyday problems for my neighbours.

Family life occupies a large part of my world. I share a small, sun‑filled house with my partner and our two children, aged ten and thirteen. Our weekends are a mixture of school activities, bike rides through the nearby nature reserve, and the occasional “fika” at the local café where we catch up with friends over coffee and cinnamon buns. I love the ritual of brewing a strong cup of dark roast, spreading a thin layer of butter on rye bread, and simply pausing to watch the world go by. It’s in those quiet moments that I feel most grounded.

Beyond the routine of work and family, I’m an avid reader of Swedish crime novels and a hobbyist photographer. The long summer evenings give me the perfect light to capture the subtle hues of the Swedish countryside, and I often post my pictures in the community’s online photo group. I also volunteer a few evenings a month at the local library, helping to organise storytelling sessions for younger children. Seeing a child’s eyes light up when a tale comes alive reminds me why I value community engagement so much.

My values are shaped by the simple, egalitarian principles that Sweden is known for: respect for the environment, gender equality, and a strong social safety net. I try to live those values by recycling diligently, using a bike for most of my errands, and supporting local businesses rather than big chains. I am also keen on gender‑balanced workplaces and have taken part in a mentorship program that encourages young women to consider careers in traditionally male‑dominated sectors like technical services.

When it comes to politics, I have never cast a vote. The decision stems not from apathy but from a lingering sense that the parties often speak in broad strokes that don’t reflect the nuanced concerns of everyday people like me. I have attended a few town‑hall meetings, asked questions, and voiced my thoughts, but the formal ballot has always felt a step too distant. Instead, I prefer to influence change through direct community involvement—whether that’s organizing a neighborhood clean‑up, supporting a school fundraiser, or simply listening to a neighbour’s problem and offering practical help.

Looking ahead, I hope to continue balancing my roles as a mother, a worker, and a citizen who cares deeply about the place I call home. I want my children to inherit a world where nature is protected, where kindness is the norm, and where every individual feels they can make a tangible difference, even without a ballot in hand."
6985,23-30,Men,Västervik,Upper secondary school,Did not vote,164.74637105587385,23,"I’m a 23‑year‑old man living in Västervik, a small coastal town on the southeast of Sweden. I grew up here, walking the cobbled streets of the town centre, spending summers on the archipelago and learning to appreciate the rhythm of the sea. After finishing upper secondary school—where I focused on natural sciences and a bit of computer basics—I chose not to continue straight into university. Instead, I went straight into the world of work and the mandatory military service that most Swedish men my age complete.

For the past two years I’ve been working part‑time at a local marine equipment shop that supplies kayaks, fishing gear and small sailboats to both residents and tourists. The job lets me stay close to the water I love while learning practical skills in sales, logistics and customer service. On the other half of the year I’m fulfilling my conscription duties, rotating between a communications unit and a field training camp. The experience has taught me a lot about teamwork, responsibility and the importance of reliable information—values I carry into everything else I do.

When I’m not on shift or in uniform, you’ll usually find me on the water. I own a modest 2‑meter kayak that I launch from the harbor on weekends, paddling out to the quieter islands and soaking up the silence that only the Baltic can provide. I also enjoy fishing with my dad, swapping stories while we wait for a bite, and I’m part of a small group of friends who meet every Friday night to play acoustic guitar at a local café. Music is a big outlet for me; I’m still learning the instrument, but there’s something about the simple chords that feels like a conversation with the world.

I’m a firm believer in the social model that Sweden is known for—equality, a strong welfare system, and a collective responsibility toward the environment. Growing up near an ecologically sensitive coastline has made sustainability a personal concern. I volunteer occasionally with a local clean‑up crew that picks up litter on the beaches, and I try to live a low‑impact lifestyle: cycling whenever possible, buying second‑hand clothes, and supporting local producers.

Politically, I feel a mix of frustration and hope. In the last national election I didn’t cast a vote. At the time I felt disconnected from the parties, unsure whether any of them truly represented the everyday concerns of people like me—young workers, conscripts, and small‑town residents. Since then, I’ve started following political debates more closely, especially on climate policy and youth employment, because I realize that my silence also means my voice isn’t heard. I’m not yet convinced about any single party, but I’m open to engaging more actively when I see concrete proposals that align with my values.

Overall, I see myself as a pragmatic, community‑oriented person who finds balance between work, service, and the simple pleasures of nature and music. I hope to keep learning—whether it’s a new chord, a new skill at my job, or a new perspective on how our society can become more inclusive and sustainable."
1318,18-22,Women,Stockholm,"Tertiary education, shorter than 2 years",Did not vote,1518.3343644589215,20,"I’m a 20‑year‑old woman living in the heart of Stockholm, and my days are a mix of city buzz, creative projects, and the occasional moment of quiet reflection. I grew up in a modest apartment in Södermalm, where the cobblestone streets and the smell of fresh coffee from nearby cafés shaped my early memories. My parents work in healthcare and education, so I was raised with a strong sense that learning never really stops and that helping others, even in small ways, matters.

After finishing gymnasium, I decided to take a more hands‑on route to higher education. I enrolled in a one‑year diploma program in graphic design at a local university college. The course is intensive but practical, focusing on visual communication, digital illustration, and user‑experience basics. I love the blend of theory and real‑world projects—last semester I helped a small nonprofit redesign its campaign posters, and seeing the final prints displayed around the city gave me a satisfying sense of contribution.

While I’m still completing my studies, I spend a lot of my free time exploring Stockholm’s vibrant cultural scene. I’m a regular at the Kulturhuset’s open‑mic evenings, where I sometimes read short poems I write about city life, loneliness, and the quiet moments that slip between subway rides. Music is another big part of my world; I’m into indie pop and electronic beats, and I often wander through record stores in Östermalm looking for hidden gems. When the weather turns colder, I retreat to my favorite spot in the Royal National City Park, where I sketch the bare trees and watch the city lights flicker across the water.

I’m also quite environmentally conscious. Growing up near the waterfront, I’ve always been aware of how fragile our surroundings can be. I ride the bike wherever possible, use reusable containers, and volunteer once a month with a local group that organizes beach clean‑ups and urban garden projects. Sustainability isn’t just a buzzword for me—it’s a set of habits I try to integrate into daily life, even if it sometimes feels like a small ripple in a huge ocean.

Politically, I haven’t cast a vote yet. The last national election happened when I was 18, and I chose not to vote because I felt unprepared and uncertain about the parties’ platforms. Since then, I’ve been trying to learn more about the issues that affect my generation—housing affordability, climate policy, and digital rights. I follow a few Swedish news outlets, attend occasional public debates at the city hall, and discuss politics with friends over fika. I’m not a staunch activist, but I believe in staying informed and speaking up when something matters to me.

Looking ahead, I’m excited about finishing my diploma and possibly taking on freelance design work while I consider whether to continue with a longer master’s program. I envision a career that lets me blend creativity with social impact, perhaps collaborating with NGOs or start‑ups focused on sustainability. For now, I’m content with the rhythm of my city—its museums, its parks, its cafés—and the sense that I’m carving out a small but meaningful place within it."
11768,41-50,Men,Ale,"Tertiary education, 2 years or longer",Did not vote,31.53602691242093,48,"I’m a 48‑year‑old man living in the quiet, forest‑dotted municipality of Ale, just a short drive north of Gothenburg. My childhood was spent roaming the lakes and fields that still define the area, and those open spaces have left a lasting imprint on the way I see the world. I grew up in a modest, working‑class family; my father was a carpenter and my mother worked part‑time at the local health centre. They taught me the value of hard work, integrity, and looking after one another—principles that still guide me today.

After finishing secondary school, I earned a two‑year diploma in mechanical engineering at the Chalmers University of Technology campus in Gothenburg, and later completed a bachelor’s degree in product development. The combination of practical training and academic study opened doors for me in the manufacturing sector, and for the past twenty‑plus years I’ve worked as a senior project engineer for a mid‑size company that produces components for the automotive industry. My day‑to‑day routine involves coordinating cross‑functional teams, troubleshooting design challenges, and occasionally stepping onto the shop floor to see how a prototype behaves under real‑world conditions. I find a quiet satisfaction in turning a sketch on a computer screen into a physical part that will travel on roads across Europe.

Outside of work, I’m an avid cyclist and a regular participant in the “Vätternrundan” charity ride, even though I haven’t yet completed the full 300‑kilometre loop. The rhythm of pedalling through the Swedish summer countryside provides a perfect counterpoint to the structured, deadline‑driven environment of my job. I also enjoy building a modest vegetable garden behind my house, where I grow potatoes, carrots, and a few hardy herbs. The garden is a place where I can unplug, reflect, and share fresh produce with neighbours during our informal “grill‑and‑talk” evenings in late summer.

Family life is central to who I am. I’m married to a teacher who works at a primary school in Kungsbacka, and together we have two adult children—one studying environmental science in Lund and the other working as a graphic designer in Stockholm. Our weekend routine often includes long walks along the Göta River, visits to the local sauna, and occasional trips to the archipelago where we can fish and unwind.

Politically, I have always felt a degree of distance from the formal voting process. In the last national election I chose not to cast a ballot, not because I lack opinions, but because I was skeptical of the choices presented and felt that my single vote would not make a tangible difference in the larger system. This has motivated me to stay informed through independent media, community forums, and direct conversations with people from all walks of life. I believe that engagement begins with listening and dialogue, and I try to embody that in my everyday interactions—whether I’m mentoring a junior colleague, volunteering at the local library’s reading program, or simply offering a helping hand to a neighbour in need.

In short, I am a pragmatic, community‑oriented person who values craftsmanship, continuous learning, and the simple pleasures of nature. My life in Ale is a blend of professional responsibility, family commitment, and a steady pursuit of balance between work, hobby, and civic participation."
