cell_id,age_group,gender,municipality,education_level,past_vote,expected_N_raked,age,biography
1385,71-104,Men,Stockholm,Upper secondary school,Sweden Democrats (SD),2007.484901830388,80,"I was born in the spring of 1946, just as the world was beginning to rebuild after the war. My childhood was spent in a modest apartment in Södermalm, where the cobblestone streets and the scent of fresh‑baked rye bread defined my early years. My parents were both factory workers, and they taught me the value of hard work, honesty, and looking out for one’s neighbours. I attended a local upper‑secondary school (gymnasium) where I completed my studies in 1965, focusing on practical subjects such as mathematics, Swedish literature, and basic engineering. University was never on the table for me; instead, I entered the workforce straight away, first as an apprentice carpenter and later as a foreman at a shipyard on the Baltic coast.

The 1970s were a time of rapid change in Sweden. I watched the country grow richer, the welfare state expand, and the social fabric stretch in new directions. I married my wife, a schoolteacher, in 1969, and together we raised three children in a small townhouse on the outskirts of Stockholm. Family life has always been the centre of my world; we spent weekends picnicking in Tantolunden, fishing on Lake Mälaren, and later, as the grandchildren arrived, teaching them how to tie their shoes and how to respect the rules that keep a community safe.

My professional life was grounded in the blue‑collar world. After a decade at the shipyard, I moved to a municipal maintenance job that kept the streets clean and the public parks well‑kept. I retired at 65, but I never truly stopped working. I now volunteer as a mentor at a local senior centre, helping younger retirees navigate the shift from full‑time employment to a quieter pace. I also enjoy a daily walk along the waterfront, listening to the gulls and watching the ferries glide past, and I never miss a game of ice hockey—especially when our national team makes it to the World Championships.

Politically, I have always felt a strong attachment to Sweden’s traditions and the idea of a cohesive society. Over the years I have become increasingly concerned about the rapid demographic changes, the strain on public services, and the erosion of what I consider the core values that built our nation. In the last few elections I voted for the Sweden Democrats because I believed they were the party most willing to address issues such as immigration control, law and order, and the preservation of Swedish culture. I respect democratic processes and I am convinced that a nation must protect its identity while still caring for those who truly belong to its community.

My values can be summed up in three words: responsibility, respect, and resilience. I believe that every citizen should take personal responsibility for his or her actions, that we must respect the law and each other’s rights, and that a society’s strength lies in its ability to endure hardships without losing its moral compass. I am proud of the life I have lived—a life shaped by hard work, family, and a deep love for the city that raised me. Even at eighty, I remain hopeful that the next generations will find a balance between openness and the preservation of the traditions that have made Sweden the safe, prosperous place we all cherish."
1361,51-60,Men,Stockholm,Upper secondary school,Other party,398.39118018921806,52,"I am a 52‑year‑old man living in the heart of Stockholm, a city that has been both my home and my classroom for the past three decades. I grew up in a modest suburb on the outskirts of the capital, the son of a school‑teacher mother and a carpenter father. Our household was never affluent, but it was rich in curiosity and hard work. After completing my upper secondary education at a vocational program focused on mechanical engineering, I entered the workforce directly, forgoing university in favor of practical experience.

My career began on an assembly line at a large manufacturing plant in the Södermalm district. The early years were demanding—long shifts, tight deadlines, and a steep learning curve—but they taught me the value of precision, teamwork, and perseverance. Over time I moved into supervisory roles, eventually becoming a shift manager responsible for a crew of twenty‑plus workers. I have always taken pride in fostering a safe, inclusive environment where every hand on the floor feels respected and heard.

Outside of work, I am an avid cyclist. Stockholm’s archipelago and its network of bike lanes provide endless routes for weekend rides, whether I’m cruising along the water’s edge in Djurgården or tackling the hillier streets of Hägersten. Cycling keeps me grounded, offers a chance to clear my mind, and connects me to the city’s growing sustainability movement—something I support not just in theory but in daily practice. I also enjoy tinkering in my garage, restoring an old Volvo 240 that I bought for a bargain a few years ago. The project is a labor of love, a reminder that patience and attention to detail can bring new life to something considered obsolete.

Family occupies the centre of my life. I share a small, sun‑filled apartment with my partner of twenty‑seven years, and together we have raised two children who are now studying at university. Our household is a blend of traditional Swedish values—equality, humility, and a strong social safety net—and a progressive outlook that embraces diversity and environmental responsibility. We often host dinner gatherings for friends from various cultural backgrounds, believing that dialogue over food is one of the most effective ways to build understanding.

Politically, I have never felt comfortable aligning with the major parties. In the last election I voted for a smaller, issue‑focused party that champions direct democracy, stronger local governance, and pragmatic solutions to climate change. My voting choice reflects a belief that politics should be rooted in the everyday concerns of ordinary people rather than grand ideological battles. I am skeptical of rhetoric that promises quick fixes; instead, I look for policies that are transparent, evidence‑based, and accountable.

My values are shaped by the lessons of my upbringing: hard work, fairness, and a commitment to community. I believe that a good society is built on mutual respect, where each individual’s contribution—whether on a factory floor, a bicycle path, or a family kitchen—is recognized. I am hopeful for the future, especially as I watch younger generations take up activism, technology, and art with a vigor that feels both urgent and hopeful. As I continue to navigate my own middle age, I aim to stay curious, stay engaged, and keep contributing—both in my profession and in the small ways that make our city, and our country, a better place to live."
13652,71-104,Women,Uddevalla,"Primary school, 9/10 years",Left Party (V),10.69840713976718,104,"I was born in the summer of 1922 in a small farmhouse just outside Uddevalla, and I have spent almost every day of my 104 years watching the world change from the view of the same modest garden that my parents tended. My childhood was shaped by the rhythm of the seasons, the hum of the nearby sawmill, and the stories my mother whispered while we mended clothes by candlelight. Formal schooling ended after nine years, the highest level offered in our village at the time, but those lessons—reading, arithmetic, and the Swedish language—became the tools that carried me through a life of hard work and quiet curiosity.

When the war clouds gathered over Europe in the late 1930s, Sweden remained neutral, yet the tension was palpable even in our corner of Bohuslän. I remember ration cards arriving at the door and my father’s careful budgeting of butter and sugar. The war taught me early on how communities must look after one another, a lesson that stayed with me long after the guns fell silent.

After the war, I left school to help my mother run the household and later took a job at the local textile mill. The work was demanding—long hours on noisy looms, the smell of oil and wool filling the air—but it also introduced me to a sisterhood of women who shared stories, songs, and a fierce desire for fairness. It was in those break‑room conversations that I first heard the ideas that would later draw me to the Left Party (Vänsterpartiet). The party’s focus on workers’ rights, gender equality, and a strong welfare state resonated with the values I had lived by: solidarity, compassion, and the belief that no one should be left behind.

In my thirties I married a fisherman from the harbor, and together we raised three children in a modest terraced house near the town centre. My days were a tapestry of cooking, sewing, and caring for the garden that became my sanctuary. I learned to knit intricate patterns from my grandmother and later taught those skills to my grandchildren, who now live in Stockholm and Gothenburg. The garden, too, grew with me—first a patch of potatoes and carrots, later a riot of perennials, strawberries, and a small apple tree that still bears fruit every autumn.

When I retired from the mill in the late 1960s, I devoted my energy to the local seniors’ association and the community library. I organized reading circles, helped translate pamphlets about social reforms, and participated in demonstrations for better public transport and affordable housing. Voting for the Left Party has always felt like a natural extension of those efforts; I have watched the party champion policies that protect the elderly, expand childcare, and fight climate change—issues that matter deeply to someone who has seen both the industrial boom of the 20th century and the urgent need to preserve our natural coastlines.

Now, at 104, my mornings begin with a walk along the Göta älv, where I breathe the salty air and greet neighbours who still remember the days when the railway line was a lifeline for the town. I spend afternoons knitting, listening to folk songs on the radio, and sharing anecdotes with my great‑grandchildren, who are fascinated by the stories of a world without smartphones. My life has been simple, grounded in family, community, and a steadfast belief that we are stronger when we look out for each other. I may be old, but my heart still beats with the same hope and determination that guided me through a century of change."
1247,23-30,Women,Sollentuna,"Tertiary education, 2 years or longer",Left Party (V),60.55849602451002,30,"I’m a thirty‑year‑old woman living in the leafy suburb of Sollentuna, just north of Stockholm. I grew up in a modest, multicultural neighbourhood where my parents, both teachers, emphasized the importance of curiosity, solidarity and public service. After finishing gymnasium, I enrolled in a two‑year master’s programme in environmental science at Stockholm University, where I discovered a passion for translating scientific findings into practical policies that can improve everyday life.

Since graduating, I have worked as a sustainability analyst for a midsize tech firm that develops smart‑energy solutions for Swedish households. My day‑to‑day tasks involve assessing the carbon footprint of new products, coordinating with municipal planners, and drafting reports that help our clients meet the nation’s ambitious climate targets. I love the mix of data‑driven work and the chance to see tangible results—like a local school that recently switched to a solar‑powered heating system after we presented a cost‑benefit analysis.

Outside of work, I’m an avid cyclist and a regular participant in the “Bike to Work” campaign that sweeps through Stockholm County each spring. Riding along the green corridors that connect Sollentuna to the archipelago reminds me how important accessible public transport and safe cycling infrastructure are for reducing emissions and fostering community health. I also volunteer once a month at a community garden in the nearby Åkersberga district, where I help organise workshops on organic gardening and composting. These hands‑on experiences keep me grounded and connect me with neighbours from diverse backgrounds.

Culture and creativity play a big part of my life as well. I’m a member of a local reading circle that meets at the Sollentuna library, where we discuss contemporary Swedish authors and the works of international writers who tackle social justice themes. I’m currently reading a collection of essays on feminist economics, which dovetails nicely with my belief that a fair society must address gender pay gaps, childcare support, and affordable housing.

Politically, I have consistently voted for the Left Party (V) because their commitment to a strong welfare state, workers’ rights and an aggressive climate agenda aligns with my own values. I stay engaged by attending town‑hall meetings, signing petitions for increased public funding of renewable projects, and supporting grassroots campaigns that demand equitable access to education and healthcare.

Looking ahead, I hope to combine my professional expertise with more direct advocacy, perhaps by pursuing a part‑time policy fellowship that focuses on municipal climate resilience. In the meantime, I continue to enjoy the simple pleasures of a weekend fika with friends, the crisp Scandinavian autumn walks through the local nature reserve, and the sense that, in a place like Sollentuna, I can contribute to building a more inclusive, sustainable future for everyone."
19004,61-70,Men,Ludvika,Upper secondary school,Sweden Democrats (SD),348.1429316166944,69,"I was born in 1954 in a modest house on the outskirts of Ludvika, a town that has always felt like home to me. My parents were both workers – my father at the local paper mill and my mother in the school kitchen. They taught me the value of hard work, honesty, and looking after the people around you. I attended the local comprehensive school and, after finishing my upper‑secondary education in 1973, I entered the workforce rather than pursuing university studies.

For most of my adult life I was employed at the steel‑production plant that has been a cornerstone of Ludvika’s economy. I started on the shop floor, learning the ropes of the furnaces and the rhythm of the shifts. Over the years I was promoted to foreman, a role that gave me the chance to mentor younger colleagues and to see how a well‑run operation could benefit both the company and the community. When the plant downsized in the early 2000s I moved to a job as a logistics driver for a regional transport firm, delivering timber and building materials across Dalarna. I retired three years ago, just as the pandemic was easing, and now I spend my days enjoying the quieter pace of life that retirement brings.

Family has always been at the centre of my world. My wife of forty‑five years still works part‑time at the local pharmacy, and together we have raised three children who have gone on to build their own families. I am a proud grandfather to seven grandchildren, and the afternoons we spend together fishing on Lake Väsman or building simple wooden toys in the garden are some of my most treasured moments. Those simple, inter‑generational bonds remind me why community matters so much.

My interests are rooted in the landscape that surrounds Ludvika. I love walking through the pine forests, especially in the crisp autumn when the leaves turn gold and the air carries the scent of fresh bark. I am an avid hunter and have been a member of the local hunting association for decades; the discipline and respect for nature that hunting teaches have always resonated with me. In winter I strap on my cross‑country skis and glide across the frozen fields, a tradition that connects me to the generations before me.

Politically, I have always felt a strong attachment to Swedish traditions and the welfare system that allowed my parents to provide for my family. Over the years I have become increasingly concerned about the rapid changes we see in society – especially regarding immigration policies, law and order, and the preservation of our cultural heritage. In the last election I voted for the Sweden Democrats because I believed they would put a stronger emphasis on securing borders, protecting Swedish values, and ensuring that the welfare state remains sustainable for people like my children and grandchildren.

I am not a man of grand theories, but rather someone who believes that a stable society is built on responsibility, respect for the rule of law, and a shared sense of identity. I enjoy lively discussions at the local café, where I listen to differing viewpoints but always return to the core belief that we must look after each other, preserve our environment, and keep the country we love safe and prosperous for future generations."
20490,31-40,Women,Bräcke,"Tertiary education, 2 years or longer",Did not vote,10.069155734210897,31,"I’m a 31‑year‑old woman living in Bräcke, a small but lively municipality tucked away in the heart of Jämtland. The surrounding forests, lakes and rolling hills shape a lot of my daily rhythm; I love waking up to the crisp, pine‑scented air and the distant call of a loon on the water. Even though Bräcke’s population is modest, the sense of community feels surprisingly strong, and I’ve spent most of my adult life cultivating connections both within the town and beyond its borders.

After finishing high school, I pursued a two‑year master’s program in Environmental Science at Umeå University. The coursework—ranging from ecosystem management to climate policy—gave me a solid scientific foundation and sparked a lasting curiosity about how societies can live more sustainably. When I completed my degree, I returned to Bräcke because I wanted to apply what I’d learned in a place I love, and because my family still lives here. I now work part‑time as a consultant for a regional environmental NGO, helping local businesses and municipalities develop greener practices, from waste‑reduction plans to renewable‑energy feasibility studies. The job lets me blend field work—sometimes hiking up to a nearby mountain to assess a potential wind‑farm site—with office tasks, and it feels rewarding to see tangible improvements in the community.

Outside of work, I’m an avid reader. My shelves are a mix of contemporary Swedish fiction, classic literature, and the latest research on climate resilience. I also play the acoustic guitar, a hobby I picked up during university when late‑night jam sessions became a welcome break from heavy coursework. Music is my way of unwinding, and I often perform at informal gatherings in the local café, where a small crowd of friends and neighbors enjoy folk tunes and occasional original songs.

I’m deeply committed to equality and social inclusion. Growing up in a rural area, I saw how limited access to services—like public transport, childcare, and higher education—can isolate people, especially women and younger residents. That awareness fuels my volunteer work with a local women’s group that offers mentorship and skill‑building workshops. We aim to create a space where anyone can explore new career paths, learn digital tools, or simply share experiences over a cup of coffee.

Although I didn’t cast a ballot in the last national election, I stay politically engaged through discussion forums, community meetings, and by writing op‑eds for the regional newspaper. I believe that civic participation isn’t limited to voting; it also includes pressing elected officials for transparency, organizing grassroots initiatives, and educating others about the issues that matter most.

In my free time I love exploring the outdoors—cross‑country skiing in winter, kayaking in summer, and foraging for berries and mushrooms year‑round. These activities keep me grounded and remind me why protecting our natural heritage is so vital. Whether I’m drafting a sustainability report, strumming a chord, or trekking through the forest, I try to live in a way that respects the environment, supports my community, and encourages continuous learning."
5366,18-22,Men,Vetlanda,"Primary school, 9/10 years",Sweden Democrats (SD),149.72247501262413,21,"I’m a 21‑year‑old man living in Vetlanda, a modest town in Småland that feels like a big family. I grew up in a single‑storey house on the edge of the forest with my parents and two younger sisters. My dad works at the local paper mill, and my mom has been a part‑time cleaner at the school since I was a child. We never had a lot of extra cash, but there was always food on the table, a warm hearth in winter, and a strong sense that we could rely on each other.

My schooling stopped after the ninth year of compulsory education. I didn’t go on to gymnasium because I wanted to start earning and helping my family right away. After finishing school I took a job as an assistant in a small carpentry workshop owned by a neighbour. The work is hard, the wood smells of pine and varnish, and the days are long, but I like seeing something take shape from raw timber. It gives me a feeling of pride that I can contribute to building something tangible for our community.

When I’m not at the workshop, I spend my free time outdoors. The lakes and woods around Vetlanda are perfect for fishing, and I’ve learned to be patient waiting for a bite while the sun sets over the water. I also enjoy playing football with a local amateur team; the matches are informal, but the camaraderie on the pitch is something I look forward to each weekend. In the evenings I sometimes sit with friends at the corner pub, where we discuss everything from the latest hockey results to what’s happening in the national news.

My values are shaped by the everyday reality of life in a small town. I believe in personal responsibility, hard work, and looking after the people close to you. I’m proud of Swedish traditions—our holidays, our language, the simple pleasure of a fika with a fresh cinnamon bun. At the same time, I’m concerned about changes that feel too rapid or that seem to ignore the needs of people like my family. That’s why, in the last election, I voted for the Sweden Democrats. I felt they spoke most clearly about preserving our community, protecting our borders, and ensuring that public resources first go to those who have lived here all their lives. I’m not a racist; I just want a society where the rule of law is respected and where newcomers can integrate without overwhelming the places that already exist.

Looking ahead, I hope to finish an apprenticeship in carpentry and maybe one day run my own workshop. I also want to stay involved in local initiatives—whether it’s helping to maintain the town’s walking trails or organizing a youth football tournament. For me, a good life is built on solid work, reliable relationships, and a community that looks after its own."
