cell_id,age_group,gender,municipality,education_level,past_vote,expected_N_raked,age,biography
22800,61-70,Women,Pajala,"Tertiary education, 2 years or longer",Social Democrats (S),71.50876660821312,68,"I am a 68‑year‑old woman who has spent most of my life in the quiet, forest‑lined municipality of Pajala, up in the far north of Sweden. I was born and raised here, in a modest wooden house on the edge of the town centre, where the long winter nights are illuminated by the shimmering aurora borealis and the summer days stretch into endless twilight. My parents were both school teachers, and the value they placed on learning shaped the path I chose for myself.

After finishing secondary school in Pajala, I moved to Umeå to pursue higher education. I earned a two‑year diploma in social work at the University of Umeå, followed by a bachelor's degree in public administration at the same institution. The experience of living in a larger city broadened my horizons, but I always felt a pull back to my hometown, where the sense of community felt strongest. I returned to Pajala in my late twenties and began a career with the municipal social services department. For more than thirty years I worked as a case manager, helping families navigate the welfare system, supporting the elderly, and coordinating services for the small but vibrant Sami population that lives in the region. Retirement didn’t mean stepping away; I now volunteer part‑time at the local senior centre, where I lead a knitting circle and mentor younger volunteers.

My life has been framed by the rhythms of the northern landscape. I love cross‑country skiing, and every winter I join a small group that trails through the pine‑covered hills and over frozen lakes, often stopping to listen to the crackle of the frost under our boots. In summer, I take long walks along the Lule River, watching the water rush past the old wooden bridges that have stood since my grandparents’ time. Nature is a source of both peace and inspiration, and I am a strong advocate for preserving the pristine environment that defines our region. I am an active member of a local conservation group that monitors forest health and pushes for sustainable forestry practices.

Reading has always been a refuge. My shelves are filled with a mix of Swedish classics, contemporary Nordic crime novels, and a few translations of world literature. I am particularly fond of authors who explore social justice and the human condition, which aligns with the values that guided my vote for the Social Democrats throughout my adult life. I believe in a society where everyone has access to good education, health care, and a dignified retirement, and I have seen how those principles can make a tangible difference in a small community like ours.

Family remains at the centre of my world. I have three adult children, all of whom have chosen different paths—one is a teacher in Kiruna, another works in the tech sector in Stockholm, and the youngest runs a small eco‑tourism business that invites visitors to experience the northern lights responsibly. My grandchildren visit during school holidays, filling the house with laughter, stories, and the occasional chaotic game of “tag” in the snow. I cherish these moments, because they remind me that the future is built on the connections we nurture today.

In sum, I am a proud northerner who values community, equality, and the natural world. My professional life has been devoted to public service, my leisure time to the outdoors and crafts, and my heart to family and friends. Even as I grow older, I remain engaged—whether it’s writing a letter to my local MP about improving broadband access in remote villages, or organizing a fundraiser for the senior centre’s winter heating fund. Life in Pajala may be quiet, but it is rich with purpose, and I feel fortunate to have spent my years contributing to the well‑being of the place I call home."
6858,51-60,Men,Nybro,"Tertiary education, shorter than 2 years",Moderate Party (M),25.01128291516727,55,"I am a 55‑year‑old man living in Nybro, a small but lively town nestled in the heart of Småland. I grew up here, the son of a carpenter and a school‑teacher, and the rhythm of life in this part of Sweden has shaped who I am. After finishing compulsory school I attended a two‑year technical program at a local college, where I earned a diploma in mechanical engineering. The short, hands‑on education suited me better than a long university track; it allowed me to get into the workforce quickly while still giving me a solid technical foundation.

For the past three decades I have worked as a maintenance supervisor at the paper mill that has been the town’s main employer for generations. My job involves keeping the complex machinery running smoothly, coordinating a team of technicians, and implementing safety and efficiency improvements. I take pride in the fact that, despite the industry’s ups and downs, we have managed to keep the mill modern and competitive, often by adopting new technologies that I helped evaluate and introduce. The work is physically demanding, but it also gives me a sense of purpose: I’m contributing to a sector that supports many families in Nybro and the surrounding region.

Outside of work, I am an avid outdoorsman. The forests and lakes around Nybro are my refuge, and I spend most weekends hiking, fishing, or tending to the modest garden behind my house. I grew up hunting with my father, and today I pass that knowledge on to my two teenage grandchildren when they visit during school holidays. I also belong to a local “frilufts” (outdoor) club, where we organize clean‑up drives and nature walks, aiming to preserve the natural beauty that defines our community.

Community involvement is important to me. I serve on the board of the municipal sports association, helping to keep the local football and handball teams funded and organized. I also volunteer at the senior center, where I lead a workshop on basic computer skills for older residents who want to stay connected with their families online. These activities keep me rooted in the social fabric of Nybro and give me a chance to give back to the place that has given me so much.

Politically, I have traditionally supported the Moderate Party. I appreciate its emphasis on personal responsibility, a strong but efficient public sector, and policies that encourage entrepreneurship and job creation—values that align with my own experience as a worker and a small‑scale community leader. I am not an ideologue; I vote with the hope that Sweden can maintain its high standards of living while allowing individuals the freedom to shape their own futures.

Family is the cornerstone of my life. My wife of 30 years, a nurse at the local health centre, and I have raised two children who now live in larger cities, but we still gather for holidays and celebrations. The sense of stability, hard work, and modest ambition that has guided my life in Nybro is what I hope to pass on to the next generation."
20024,41-50,Women,Härnösand,Upper secondary school,Green Party (MP),13.287315340579898,45,"I’m a 45‑year‑old woman living in the coastal town of Härnösand, where the forest meets the sea and the long summer evenings are spent on the waterfront. I grew up in a modest family on the outskirts of town, the daughter of a carpenter and a school‑librarian. After completing upper secondary school, I chose a path that kept me close to my community rather than pursuing a university degree. I took a vocational program in health care and have been working as a care assistant in the local nursing home for the past two decades. The work is demanding, but it gives me a daily reminder of the importance of compassion, patience, and the simple dignity of being present for others.

My life is rooted in routines that blend the practical with the passionate. Each morning I start with a brisk walk along the Stora Gatan, breathing in the salty breeze that rolls in from the Gulf of Bothnia. The walk is my meditation, a chance to notice the changing colors of the birch leaves in autumn or the first buds of spring. On weekends I tend to a small vegetable garden behind my house, growing carrots, potatoes, and kale that I use in the meals I prepare for my family and friends. There is something grounding about watching a seed sprout and knowing that the food on my table is the result of my own hands and the soil that surrounds us.

Environmental stewardship is more than a hobby for me—it’s a core value that shapes how I live. I have been a member of the local “Gröna Höjden” community group for ten years, organizing clean‑up trips along the Viksjö river, campaigning for better recycling facilities, and supporting the town’s initiative to expand its electric‑bus fleet. My political voice has always aligned with the Green Party (Miljöpartiet), which I supported in the last election because I believe in strong climate policies, social equality, and a future where economic growth does not come at the expense of nature.

Culture also plays a big part in my identity. I love Swedish folk music and often attend the summer concerts in the old town square, where the fiddles and accordions echo the stories of our ancestors. When I’m not gardening or working, I can be found curled up with a book by Selma Lagerlöf or a contemporary novel that explores social issues. I also enjoy knitting—my scarves and mittens are a small way of contributing warmth to the cold winter months, and I often donate finished pieces to the local shelter.

Family is my anchor. My partner and I have raised two grown‑up children who have moved to different parts of Sweden, but we still gather for Sunday lunches, sharing homemade dishes and laughter. Our home is a place where conversation flows freely, from debates about municipal policies to plans for the next hiking trip in the High Coast.

In essence, I am someone who finds meaning in everyday connections—whether it’s caring for an elderly resident, planting a seed, or advocating for a greener future. My life in Härnösand is a tapestry woven from community, nature, and a steady belief that small, consistent actions can create lasting change."
18050,71-104,Men,Gagnef,"Primary school, shorter than 9 years",Social Democrats (S),63.20984535281595,93,"I was born in the spring of 1933, in a small wooden house on the outskirts of Gagneviken, a hamlet that later became part of the municipality of Gagnef. My earliest memories are of the long, cold winters when the snow piled up to the windowsill and my mother would light a thick stove to keep the house warm while we listened to the radio’s crackling news. My father was a forest worker, and after I turned ten I left the tiny school that had only eight grades to help him fell trees, haul timber, and tend the family garden. Formal education was a luxury we could not afford, but the forest taught me lessons that no classroom ever could.

When I was seventeen I was conscripted into the Swedish Armed Forces for a year of service. The experience broadened my horizons; I met young men from Stockholm, Malmö and the far north, and we shared stories over coffee in the mess hall. After my service I returned to Gagnef and took a job at the local sawmill. The work was hard, the hours long, but there was a deep satisfaction in seeing a raw log become a sturdy beam that would later support a house or a school.

In 1955 I married my childhood sweetheart, a bright‑eyed girl from the neighboring farm who taught me how to bake the best cinnamon buns in the parish. Together we raised three children—two sons and a daughter—who have since moved to larger towns, but they always come back for the family gatherings at our old cottage by the lake. My grandchildren now visit every summer, and I love teaching them how to cast a line into the clear water, how to identify the call of the black woodpecker, and how to respect the land that has given us so much.

The post‑war years were a time of great change in Sweden. I watched the country build a welfare state that promised health care, schooling, and a safety net for everyone, no matter where they lived. The Social Democratic Party’s vision of solidarity and equality resonated with me because it meant that a man who had never finished school could still receive a pension, medical care, and the chance for his children to attend a good school. I have voted for the Social Democrats in every election I have been able to cast a ballot, not out of blind loyalty, but because their policies have kept our small community alive, supported the forest workers, and ensured that the elderly like me are cared for with dignity.

Now, at ninety‑three, I spend my days walking the familiar trails that wind through pine and birch, listening to the river’s gentle murmur, and sitting on the porch with a cup of strong black tea. I take pleasure in simple things: the scent of fresh‑cut wood, the laughter of my great‑grandchildren, and the quiet camaraderie of the senior council meetings where we discuss everything from road maintenance to the best way to preserve our local dialect. My values are rooted in hard work, respect for nature, and a belief that a society should look after its most vulnerable members. Though my formal schooling was brief, life has been my teacher, and I remain grateful for the community that has nurtured me for more than nine decades."
18673,51-60,Women,Borlänge,"Tertiary education, 2 years or longer",Social Democrats (S),283.25113589815766,57,"I am a 57‑year‑old woman living in Borlänge, a vibrant town nestled in the heart of Dalarna. I grew up in a modest household not far from the river Dalälven, and from an early age I learned the importance of community, hard work, and looking after one another—values that have guided me throughout my life.

After finishing my secondary studies, I pursued a two‑year university program in social work at the University of Gävle, followed by a bachelor’s degree in public health at Uppsala. My education opened doors to a career that has been both challenging and rewarding: I spent the bulk of my professional life as a municipal social worker, first in the city’s youth services and later in the elder‑care department. The job allowed me to see the everyday realities of families, the elderly, and newcomers alike, and it reinforced my belief that a strong welfare state is the backbone of a just society.

In 2018 I decided to transition to a part‑time role as a mentor for young adults entering the labour market, a position that lets me share the lessons I have learned while still keeping a connection to the issues that matter most to me. I am approaching the age when many of my colleagues begin to think about retirement, but I feel energized by the prospect of staying involved—perhaps by volunteering at the local library or by joining the town’s environmental committee, where we lobby for greener public transport and more bike lanes.

My personal life is anchored by my family. My two children are now grown, living in Stockholm and Malmö, and I am the proud grandmother of four lively grandchildren who visit every summer. Their curiosity and boundless energy remind me daily why I have always championed education and equal opportunities. When I’m not at work or caring for family, I love to explore the surrounding countryside. Hiking in the forested hills around Orsa, cross‑country skiing in the winter, and taking leisurely walks along the lake are my ways of recharging. I also enjoy traditional Swedish folk music, and I’m a regular at the local folk dance evenings where I can spin a waltz with friends from all walks of life.

Politically, I have consistently voted for the Social Democrats. Their commitment to a robust public sector, affordable healthcare, and a fair tax system resonates with my own experiences as both a beneficiary and a contributor to the welfare model. I am an active member of the local party branch, where I help organize community forums on topics ranging from housing affordability to climate action. I believe that democracy thrives when citizens are engaged, and I try to set an example for the younger generation by staying informed and involved.

In short, I am someone who values solidarity, lifelong learning, and the simple pleasures of Swedish nature. My journey—from a small‑town upbringing to a career dedicated to public service, and now to a phase of mentorship and community activism—reflects a deep‑seated conviction that we are all responsible for building a society where everyone can thrive."
3305,41-50,Men,Eskilstuna,"Tertiary education, shorter than 2 years",Social Democrats (S),156.89780250409257,41,"I’m a 41‑year‑old man living in Eskilstuna, a midsized town on the banks of the Eskilstuna River that has a strong industrial heritage and a growing cultural scene. I grew up in a modest household; my parents worked at the local paper mill and later in municipal services, which gave me an early appreciation for the importance of community, steady work, and the social safety net that Sweden is known for.

After finishing gymnasium, I enrolled in a two‑year technical program at a nearby university college, focusing on mechanical engineering and automation. The short‑term, hands‑on curriculum suited me better than a long academic track, and I earned a diploma that opened doors to the manufacturing sector. For the past fifteen years I have worked as a maintenance supervisor at a company that produces components for the automotive industry. My role involves coordinating a small team of technicians, scheduling preventive maintenance, and ensuring that we meet the strict safety and environmental standards that Swedish law mandates. I enjoy the blend of problem‑solving, teamwork, and the tangible sense of keeping the production line running smoothly.

Family life is the centre of my world. I’m married and have two children, a 12‑year‑old daughter and a 9‑year‑old son. Weekends are a mix of school runs, helping with homework, and family outings. We love exploring the surrounding countryside—hiking in the forested hills around Lake Mälaren, cycling along the river, and occasionally taking a short ferry trip to the archipelago for a summer barbecue. My daughter is passionate about music and plays the violin; my son is an avid football fan and plays for the local youth team. I try to be as present as possible, whether that means cheering from the sidelines or attending school concerts.

Politically, I have consistently supported the Social Democrats. The party’s focus on a strong welfare state, universal healthcare, and policies that protect workers resonates with my own experiences and values. I believe that a society should provide everyone with a decent standard of living, good education, and the chance to participate fully in civic life. I’m an active member of the local Social Democratic branch, where I volunteer during election campaigns and help organise community forums on topics such as affordable housing and climate‑friendly public transport.

In my spare time I enjoy reading non‑fiction, especially books about Swedish social history and the evolution of the labour movement. I’m also a regular at the city’s public library, where I sometimes attend talks on sustainability and digital innovation. When the weather permits, I head to the ice‑rink with friends for a game of bandy—a classic Swedish winter sport that reminds me of my own school days.

Overall, I see myself as a pragmatic, community‑oriented person who values solidarity, fairness, and the small‑scale actions that keep our town thriving. I’m proud of my roots in Eskilstuna, grateful for the opportunities my education and work have given me, and hopeful that the next generation will inherit a society that continues to balance economic progress with social responsibility."
22578,71-104,Women,Kalix,"Primary school, shorter than 9 years",Social Democrats (S),90.2606410111015,80,"I was born in the spring of 1946 in a small wooden house on the edge of Kalix, a quiet municipality tucked along the river in the far north of Sweden. My parents were farmers; the land stretched out in endless rows of rye and potatoes, and the seasons marked the rhythm of our lives. School was a modest one‑room building in the village, and I attended only until I was about nine years old. Formal education stopped there, but learning never did – the world taught me its lessons through work, family, and the community that surrounded us.

When I was a teenager, I left school to help my mother with the harvest and later to work in the local sawmill. The work was hard, the air thick with sawdust, but it gave me a sense of purpose and a deep respect for the people who built our town’s livelihood. In those years I also learned to knit, a skill passed down from my grandmother. The rhythmic click of needles became a meditative ritual, and the scarves and sweaters I made found their way to friends, neighbours, and eventually my own grandchildren.

In the 1960s, the Social Democratic Party’s promise of a stronger welfare state resonated with my own hopes for a fairer society. I voted for them in my first election and have continued to support their vision of universal healthcare, free education, and a safety net for the elderly. The reforms that followed—public pensions, improved medical services, and better schools for my children—were not abstract policies to me; they were the very things that made my family’s life more secure.

I married a kind-hearted man from the nearby village, and together we raised three children. We taught them the value of hard work, humility, and solidarity. Today, two of my children live in larger towns, but they return to Kalix for holidays, bringing fresh ideas and stories from the cities. My grandchildren, who grew up with smartphones and the internet, are a source of endless fascination for me; I love listening to their digital adventures while I share tales of life before electricity reached every corner of our community.

Even at eighty, I find joy in simple pleasures. I still tend a modest garden behind my house, growing carrots, beetroot, and the occasional dill to flavor the soups I make for my neighbours. On crisp winter evenings, I sit by the fire, listening to the crackle and the distant hum of the river, and I recall the days when the whole town gathered in the modest church hall to sing hymns and discuss the news of the day. I am grateful for the strong sense of community that still thrives in Kalix; we look out for one another, share food, and help each other with snow‑shovelling or small repairs.

My values are rooted in empathy, equality, and a belief that every person, regardless of age or background, deserves dignity and respect. I have seen Sweden transform from a post‑war agrarian society into a modern welfare state, and I cherish the progress we have made while staying humble about the work that remains. Life has taught me that kindness, perseverance, and a willingness to lend a hand are the true measures of a good society, and I try to embody those principles every day, whether I’m knitting a blanket for a new mother, offering advice to a young farmer, or simply sharing a warm smile with a passer‑by."
