year,state,text
2024,National,"The following is a list of events of the year 2024 in the United States.
With the dominant political story of the year being the 2024 presidential election, most American-focused media outlets routinely covered the nominees. Former president Donald Trump became the second president in American history to win two nonconsecutive terms, defeating Democratic vice president Kamala Harris, who became her party's nominee after incumbent president Joe Biden withdrew from the race. Much of the national media paid close attention to Trump's civil and criminal trials, as well as two assassination attempts on Trump: one in July (where his ear was injured) and one in September (thwarted by the Secret Service).
American politics also focused on responses to the Israel's ongoing war on Gaza that started in the year prior (particularly the protests on college campuses against Israel), recent developments in abortion policy, and the passing of a law that de jure banned TikTok in January of the following year.
The Federal Trade Commission, under chair Lina Khan, also played a more proactive role in the economics of the U.S., with Khan blocking many mergers and acquisitions, including one between airlines JetBlue and Spirit. In business, the American economy underwent a bull market, with Nvidia in particular, due to demand for its chips in the use of artificial intelligence, becoming the third largest publicly traded company by market capitalization, and partially enabling major American stock indices such as the S&P 500 to achieve record highs. Nvidia's success story, though, was contrasted by a series of safety failures, malfunctions, and crashes involving passenger aircraft designed and assembled by Boeing, among the most notable of which was Alaska Airlines Flight 1282 in which a door plug blew out. Additionally, Spirit Airlines, radio operator Audacy, for-profit hospital chain Steward Health Care System, retailers Jo-Ann Stores and rue21, restaurant chains Red Lobster and TGI Fridays, bussing company Coach USA, electric vehicle maker Fisker, and food storage container firm Tupperware have filed for Chapter 11 bankruptcy.
Several major hurricanes and tornado outbreaks occurred across the United States during the year, including the tornado outbreak sequence of May 19–27, Hurricane Helene, and Hurricane Milton.

Incumbents
Federal government
President: Joe Biden (D-Delaware)
Vice President: Kamala Harris (D-California)
Chief Justice: John Roberts (Maryland)
Speaker of the House: Mike Johnson (R-Louisiana)
Senate Majority Leader: Chuck Schumer (D-New York)
Congress: 118th

State governments
Elections
The US general elections were held on November 5 of this year. In the federal government, the offices up for election were president, vice president, all 435 seats of the House of Representatives, and roughly one third of the Senate. In this year's presidential election, Joe Biden ran for a second term. With former president Donald Trump's declaration to run for the office again and both he and Biden were their respective parties' presumptive presidential nominees, the election would have been a rematch of the 2020 election. On July 21, 2024, however, President Biden announced his withdrawal from the presidential race and endorsed his vice president Kamala Harris as the Democratic nominee. In the Senate, at least seven seats, those of Senators Tom Carper from Delaware, Mike Braun from Indiana, Ben Cardin from Maryland, Debbie Stabenow from Michigan, Bob Menendez from New Jersey, Mitt Romney from Utah, and Joe Manchin from West Virginia, will be open contests; the seat of the late Dianne Feinstein is also expected to be an open contest with Feinstein's immediate successor, Laphonza Butler, expected not to seek a full term.
Concerning state governments, 11 states and two territories will hold gubernatorial elections, and most states and territories will hold elections for their legislatures. Many major cities, including Baltimore, Las Vegas, Honolulu, Milwaukee, Miami, Phoenix, San Diego, and San Francisco will also elect their mayors.

Special elections
February 13 – Republican George Santos was expelled from the House of Representatives in December 2023 after an investigation for corruption charges, vacating New York's 3rd congressional district. In the special election, Democrat Tom Suozzi reclaimed his former seat against Republican Mazi Melesa Pilip, flipping the swing district and narrowing the margin of Republican control in Congress.
April 30 – A special election was held in New York's 26th congressional district after Brian Higgins resigned to become president of Shea's Performing Arts Center in Buffalo. Democrat Tim Kennedy was elected to succeed him.
May 21 – Republican Kevin McCarthy, who was ousted from his position as speaker of the House in October 2023, resigned from Congress at the end of the year. In the special election for California's 20th congressional district, Republican Vince Fong defeated fellow Republican Mike Boudreaux in a runoff to succeed McCarthy.
June 11 – A special election was held for Ohio's 6th congressional district following the resignation of Bill Johnson, who accepted the position of president of Youngstown State University. Republican Michael Rulli defeated Democrat Michael Kripchak by a smaller margin than expected.
June 25 – A special election was held for Colorado's 4th congressional district after Republican Ken Buck resigned early after initially announcing his retirement at the end of the term. Republican Greg Lopez won the election against Democrat Trisha Calvarese and Libertarian Hannah Goodman.
September 18 – Democrat Donald Payne Jr. of New Jersey's 10th congressional district died in April 2024 following a heart attack caused by complications of diabetes. Democrat LaMonica McIver defeated Republican Carmen Bucco in the special election for the fully urban district.
November 5
Following the death of California senator Dianne Feinstein in September 2023, governor Gavin Newsom called for a special election to be held concurrently with the scheduled regular election for the same seat. Democrat Adam Schiff and Republican Steve Garvey advanced to the general election through a nonpartisan blanket primary.
Nebraska will hold a special election for its Class 2 Senate seat following the resignation of Ben Sasse in January 2023 to serve as president of the University of Florida. Incumbent Republican senator Pete Ricketts, who was appointed by Governor Jim Pillen, is running for a full term and will face Democrat Preston Love Jr. in the general election.
Democrat Sheila Jackson Lee died from pancreatic cancer in July 2024 while serving her 15th term in Texas's 18th congressional district. The sole Democratic candidate for the special election is Erica Lee Carter, the daughter of Jackson Lee.
Republican Mike Gallagher, who chaired the recently formed House Select Committee on China, resigned from Congress in April 2024 over his opposition to the impeachment of Homeland Security secretary Alejandro Mayorkas. The special election for Wisconsin's 8th congressional district will be held between Republican Tony Wied and Democrat Kristin Lyerly.

Events
January
January 1
Public Domain Day: Books, films, and other works published in 1928 enter the public domain. The most notable work entering into the public domain is Steamboat Willie, the earliest version of Mickey Mouse, leading to the announcement of multiple works based on this version of the character.
Four people, including the perpetrator, are killed in a vehicle attack in Rochester, New York.
January 2 – Harvard University president Claudine Gay announces her resignation following a contentious house hearing on antisemitism and allegations of plagiarism in her earlier academic career.
January 3 – A series of documents containing the names of associates of sex offender Jeffrey Epstein are made available to the public. A majority of those mentioned are found to not be directly involved in any wrongdoing.
January 4
Criminal proceedings in the January 6 United States Capitol attack: Former Proud Boys member Christopher John Worrell is sentenced to 10 years in prison.
Two people are killed and six others are injured in a school shooting in Perry, Iowa. The shooter, a 17-year-old student at the school, committed suicide at the scene. A principal who tried to intervene and was shot later died from his injuries on January 14.
January 5 – Alaska Airlines Flight 1282 suffers an uncontrolled decompression after one of the emergency exit doors on the Boeing 737 MAX 9 blows out, resulting in an emergency landing in Portland and the FAA grounding all 737 Max 9s.
January 7 – Audacy, the largest radio operator in the country, files for Chapter 11 bankruptcy protection.
January 8
Clashes break out at the World Headquarters of the Chabad-Lubavitch movement in Brooklyn, New York City after construction workers for the synagogue leaders attempted to fill in a tunnel that students had illegally dug beneath the building, resulting in the arrest of nine people. The incident causes antisemitic social media posts by far-right and QAnon figures to spread online.
The Michigan Wolverines defeat the Washington Huskies by a score of 34–13 to win the College Football Playoff National Championship.
January 8–10 – A storm complex, which caused $2.7 billion (2024 USD) in damage, brought a winter storm to the northern United States and a tornado outbreak to the Gulf Coast.
January 10
Former New Jersey governor Chris Christie suspends his 2024 campaign for president.
Florida-based grocer Publix opens their first Kentucky store near the Gene Snyder Freeway in Louisville, entering their 8th U.S. state of operation.
January 11
The New England Patriots mutually part ways with longtime head coach Bill Belichick after a notably poor season for the team.
The Texas National Guard seizes a park in the border town of Eagle Pass, Texas in response to the growing Mexico–United States border crisis and does not allow Border Patrol agents in the area as they previously used the park to detain migrants and instead places their own barbed wire and barriers.
January 12
Operation Prosperity Guardian: A US-led coalition launches air strikes at Houthi militant locations in Yemen, marking a retaliation to the Houthi's attacks on ships in the Red Sea.
Heartland Signal leaks a video of Texas Governor Greg Abbott making controversial comments about Texas shooting migrants who cross the Mexico–United States border on a Dana Loesch Show which lead to condemnations from Democratic party members and Mexico.
January 13 – Gaza war protests in the United States: The March on Washington for Gaza takes place on the 100th day since the start of the Gaza war, the start of South Africa's genocide case against Israel in the ICJ, and a day after the Yemen missile strikes, attracting what is believed to be over 100,000 protestors.
January 14
The Detroit Lions win their first postseason game since the 1991–92 playoffs with a 24–23 win against the Los Angeles Rams.
The Green Bay Packers become the first 7th seed to defeat a 2nd seed in the playoffs since its introduction in the 2020–21 playoffs.
January 15 – 2024 Republican Party presidential primaries: Ohio businessman Vivek Ramaswamy ends his presidential campaign after securing only 7.7% of the vote in the Iowa caucuses. Former Governor of Arkansas Asa Hutchinson ends his campaign the next day after receiving less than 1% of the vote in the same.
January 16 – Harvey Weinstein sexual abuse cases: A new lawsuit is filed by Kellye Croft against Madison Square Garden Entertainment chairman James L. Dolan, accusing him of pressuring her into unwanted sex back in 2014. She also files a lawsuit against American former film producer Harvey Weinstein, accusing him of sexually assaulting her.
January 18 – The United States Congress approves a stopgap bill to extend the deadline for government funding to March 2024, narrowly avoiding a government shutdown, which would have begun at midnight, January 19.
January 19 – Alec Baldwin is indicted for involuntary manslaughter after an accidental shooting on the set of Rust in 2021 which killed cinematographer Halyna Hutchins and injured director Joel Souza.
January 20 – At least 60 people are killed across the country after two weeks of winter storms that caused dangerous road conditions and widespread power outages that could take weeks to fix.
January 21
2024 Republican Party presidential primaries: Governor of Florida Ron DeSantis suspends his campaign for president after a poor showing in Iowa and waning poll numbers in New Hampshire.
A series of shootings take place around Joliet, Illinois, killing eight and injuring one. Two days later, the perpetrator takes his own life after being confronted by law enforcement in Natalia, Texas.
January 24 – During the Standoff at Eagle Pass, part of the broader Mexico–United States border crisis, the Supreme Court rules against Texas for placing barbed wire at the border with Mexico. In response, Texas Governor Greg Abbott announces that his state would not be following the orders of the court. At least 23 states announce their allegiance to Texas, including Florida, who has sent their own National Guard unit to aid the Texas National Guard and Texas Rangers.
January 25
Convicted murderer Kenneth Smith is executed in the Holman Correctional Facility in Alabama, using nitrogen hypoxia, the first death row inmate to die via this method.
The United States Department of Commerce issues a $15 million bounty for information on Hossein Hatefi Ardakani, an Iranian businessman accused of procuring parts for drones assembled by Iran's Islamic Revolutionary Guard Corps that were later sold to Russia.
January 26
In E. Jean Carroll v. Donald J. Trump, the jury awards Carroll $83.3 million after finding the defendant guilty of defamation.
The Justice Department finds former New York Governor Andrew Cuomo liable for sexual harassment.
AWS announced plans to break ground on two large data center facilities in Mississippi, marking a $10 billion investment expected to create 1,000 jobs.
January 27 – The US suspends UNRWA funds after claims come out that 12 staff members took part in the October 7 attacks in 2023, which included American victims.
January 28 – Tower 22 drone attack – An Iranian-backed militant group launches a drone attack on a US base in Jordan, killing three and wounding 47. The US launches several missiles at Iraq and Syria in retaliation for the drone attack four days later.

February
February 1
Gaza war: The US imposes sanctions on Israeli settlers over the violence in West Bank.
Three people are killed when a Beechcraft Bonanza V35 crashes into a waterfront house in Clearwater, Florida. Two of the casualties are on the ground while the third is the pilot. Three other houses are damaged by a fire which results from the crash.
The Oregon Supreme Court upholds Ballot Measure 113 by banning ten of the 12 Republican members of the Oregon Senate for refusing to attend six weeks worth of legislative sessions in order to stall Democratic legislation.
February 4
The 66th Annual Grammy Awards are held at the Crypto.com Arena in Los Angeles. ""Flowers"" by Miley Cyrus wins Record of the Year and Midnights by Taylor Swift wins Album of the Year.
The schedule for the 2026 FIFA World Cup, which will be co-hosted by the US, Canada, and Mexico, is released. A total of 78 games will be played in the US, including the final.
February 6
Social media network Bluesky, seen as a potential rival to X, is opened for public registrations, dropping its previous invite-only format.
Toyota announced a $1.3 billion investment in a new Kentucky factory for a three-row electric SUV and EV battery packs.
February 7
Self-help author Marianne Williamson ends her presidential campaign after losing three Democratic primaries to President Biden.
2024 East Lansdowne shooting: At least six members of a family are presumed dead in a house fire in East Lansdowne, Pennsylvania following a shooting which injured two police officers.
Children's Health and UT Southwestern Medical Center announced plans for a $5 billion campus in the Medical District near Clements University Hospital in Dallas, Texas.
February 8
Five US Marines are found dead two days after the CH-53E Super Stallion helicopter they were in crashed in the mountains outside of San Diego during a routine training flight from Creech Air Force Base to Marine Corps Air Station Miramar.
Joe Biden classified documents incident: Special counsel Robert K. Hur recommends that no charges be brought against President Biden, though notes in Hur's report regarding Biden's failure to recall events prompt controversy regarding his age and memory.
Tucker Carlson conducts The Vladimir Putin Interview in Moscow, where Vladimir Putin shares his reasons for the 2022 Russian Invasion of Ukraine. The interview is accused of promoting Russian disinformation and pro-war propaganda.
Sixteen-year-old non-binary Oklahoma student Nex Benedict dies after an incident stemming from repeated bullying at their high school due to their gender identity. This results in backlash towards Ryan Walters, the Oklahoma Superintendent of Public Instruction who has defended Oklahoma's anti-LGBT policies, and calls to investigate Nex's death as a hate crime.
February 9
Six people, including CEO of Access Bank Herbert Wigwe and former chair of the Nigerian Exchange Group Abimbola Ogunbanjo, are killed when their helicopter crashes near Baker, California en route to Las Vegas for Super Bowl LVIII.
Hop-A-Jet Flight 823 suffers a dual engine failure en route from Columbus, Ohio to Naples, Florida and attempts to land on Interstate 75, but this destroys the aircraft and kills the two pilots, though the two passengers and one flight attendant survive.
February 11 – The Kansas City Chiefs win Super Bowl LVIII against the San Francisco 49ers 25–22 in overtime at Allegiant Stadium in Las Vegas, the second Super Bowl to go into overtime after Super Bowl LI. The Chiefs are the first repeat champions since the New England Patriots in 2004.
February 12 – A shooting takes place on a 4 Train and at Mount Eden Avenue station in New York City, killing one and injuring five.
February 13 –  Secretary of Homeland Security Alejandro Mayorkas is impeached by the House of Representatives.
February 14 – 2024 Kansas City parade shooting: One person is killed and at least nine are injured after a mass shooting during the Kansas City Chiefs' Super Bowl LVIII championship parade at Union Station in Kansas City, Missouri. Two armed suspects were arrested at the scene.
February 15
The US launches six missile-detecting satellites into orbit in response to a ""serious national security threat"" related to Russia wanting to implement its nuclear capabilities in outer space.
Odysseus, the first US lunar lander since the unsuccessful Peregrine Mission One, is launched at the Kennedy Space Center Florida, United States.
Scout Motors announced the start of construction on its $2 billion electric SUV plant in South Carolina.
February 16
New York civil investigation of The Trump Organization: Judge Arthur Engoron orders Trump and his companies to pay $355 million ($464 million after interest is added) as a result of being found liable for several counts of fraud. Additionally, his sons Donald Jr. and Eric are ordered to each pay $4 million and former chief financial officer Allen Weisselberg is ordered to pay $1 million. Ten days later, Trump files an appeal of the judge's holding in the case.
An official committee that was appointed to represent the plaintiffs in the Sandy Hook lawsuits against Alex Jones unanimously votes to liquidate the far-right-wing conspiracy theorist's assets.
February 17 – Former congressman George Santos sues late night host Jimmy Kimmel for $750,000 on charges of copyright infringement, fraud, breach of contract, and unjust enrichment after Kimmel purchased Cameo videos from Santos through fake names then used them on his show.
February 18 – 2024 Burnsville shooting: Police and medics were fired upon from a home while responding to a domestic incident in Burnsville, Minnesota. Two officers and a firefighter were killed, while another officer suffered a gunshot wound. After opening fire on first responders, the shooter fatally shot himself.
February 19 – The 2024 Daytona 500 is held with William Byron of Axalta's racing team winning.
February 20 – Three passengers who were on Alaska Airlines Flight 1282 sue Boeing for $1 billion for negligence, claiming the incident caused them physical injuries and post-traumatic stress disorder.
February 21
Biden cancels another $1.2 billion of student loan debts for nearly 153,000 people.
Capital One announces an agreement to acquire Discover Financial and its namesake credit card network for nearly $35 billion.
LePage v. Center for Reproductive Medicine: The Alabama Supreme Court rules that frozen embryos can be considered children under state law.
A ransomware attack cripples Change Healthcare's payment system, disrupting insurance claims and making it difficult for patients to get the prescription medicine that they need.
February 22
AT&T suffers from network outages impacting around 71,000 customers, which also affect Verizon and T-Mobile to a smaller degree. The outages were acknowledged, but no reason was given for their occurrence. Two days later, AT&T announced affected customers will be credited $5 on their next bill, the ""average cost of a full day of service.""
Houston-based Intuitive Machines' Nova-C lander becomes the first commercial vehicle to land on the Moon.
Augusta University student Laken Riley is murdered while out on a jog by Jose Antonio Ibarra, a 26-year-old Venezuelan citizen who entered illegally in 2022. Her murder sparks media attention and debates about immigration.
February 23
The Biden administration announces over 500 new sanctions on Russian financial institutions, military institutions, sanctions evasion, energy production, and prison officials linked to the death of Alexei Navalny.
A high-altitude balloon is detected over Utah, prompting the deployment of fighter aircraft to intercept the object. The origin and purpose of the balloon are unknown, according to US officials.
February 25 – Gaza war protests in the United States: An Air Force member, identified as Aaron Bushnell, commits self-immolation in front of the Embassy of Israel in DC, as a protest against American support of Israel's war against Hamas. He later died of his injuries.
February 26 – The body of Mahogany Jackson is discovered in an illegal dump site in Birmingham, Alabama.
February 27 – The Smokehouse Creek Fire in the Texas panhandle burns almost 200,000 acres, resulting in a state of emergency for the area.
February 28 – Mitch McConnell announces that he will step down as Senate Republican leader in January 2025. He's been serving as the Senate Republican leader since 2007.

March
March 2 – United States support for Israel in the Gaza war: The United States military announces plans to begin airdropping humanitarian aid into Gaza.
March 3 – Caitlin Clark breaks the all-time NCAA Division I college basketball career scoring record that had been held by Pete Maravich with 3,685 points.
March 4
In Trump v. Anderson, the US Supreme Court unanimously rules that states can not keep presidential candidates off the ballot, overturning the Colorado Supreme Court's decision in Anderson v. Griswold.
2022–2023 Pentagon document leaks: Jack Teixeira, a 22-year-old former member of the Massachusetts Air National Guard, pleads guilty to leaking classified Defense Department documents on his Discord server and is sentenced to 16 years and eight months in prison.
A Piper PA-32A crashes on I-40 while attempting to land at John C. Tune Airport in Nashville after suffering a mechanical failure. All five passengers on board are killed.
March 5
The Consumer Financial Protection Bureau issues a new rule capping late fees for credit cards at $8, per Biden's Executive Order on Promoting Competition in the American Economy.
Louisiana Governor Jeff Landry signs a bill that adds nitrogen gas and electrocution as execution methods.
March 6
2024 United States presidential election: Former UN Ambassador and South Carolina governor Nikki Haley suspends her 2024 campaign for President after a poor showing on Super Tuesday, leaving Trump the presumptive Republican nominee. Minnesota Representative Dean Phillips also ends his campaign for the Democratic nomination after losing several primaries to President Biden.
March 7 – President Biden delivers his third State of the Union Address.
March 8
A highway crash near Dewhurst, Wisconsin involving a van and a semi-tractor kills nine people and injures one.
A UH-72 Lakota helicopter crashes while conducting an aviation operation 41 miles west of McAllen, Texas, killing one border patrol agent and two National Guard soldiers and injuring another.
Former Honduran president Juan Orlando Hernández is found guilty in a Manhattan court of conspiring with drug traffickers and enabling the transportation of over 400 tons of cocaine from Honduras to the US.
March 9 – Utah adopts its new state flag, 113 years after the adoption of its former flag.
March 10
The 96th Academy Awards are held at the Dolby Theatre in Los Angeles. Christopher Nolan's Oppenheimer is nominated for 13 awards and wins seven, including Best Picture. The ceremony draws an average of 19.5 million viewers, a 4% increase from the previous year.
Five people are killed during a mass stabbing and murder–suicide in Manoa, Honolulu.
An IAI 1125 Astra SP crashes while on approach to Ingalls Field Airport in Hot Springs, Virginia. All five people on board are killed.
