year,state,text
Anthropic rejects a Pentagon request to loosen security safeguards on the Claude large language model for potential use in mass surveillance and autonomous weapons systems. In response, Trump orders federal agencies to stop using Anthropic's technology, and OpenAI signs a deal with DOD.
February 28
Iran War: The U.S. and Israel launch attacks on cities in Iran, and assassinate Iran's Supreme Leader Ali Khamenei. Iran launches retaliatory strikes against U.S. and Israeli military bases in the Gulf, with explosions reported in Bahrain, Iraq, Kuwait, Oman, Qatar, Saudi Arabia, and the United Arab Emirates, as well as additional spillover in Jordan and Syria.
Iran war protests
Anti-war protests are held in cities such as New York City, Portland, and Philadelphia.
In Washington DC, anti-war protests organized by groups such as 50501 and Code Pink are held near the White House. Additionally, diaspora protests are held near the World War I Memorial with demonstrators holding American and Israeli flags praising the strikes.
An anti-war protest is held in Los Angeles at the City Hall to call for an end to American military actions in the Middle East. American actress and activist Jane Fonda takes part in the protest.

March
March 1
2026 Austin bar shooting: Four people are killed, including the perpetrator, and 15 others are injured in a mass shooting at a bar in Austin, Texas. The FBI investigate the attack as potential terrorism, with the possible motive being linked to the U.S. strikes on Iran.
2026 attack on the United States consulate in Karachi: In Karachi, Pakistan, protesters supportive of the Iranian government attempt to storm the U.S. consulate. The Marine Security Guard opened fire, killing several protesters.
March 2
The U.S. military reports that three of its fighter jets crashed in Kuwait due to an ""apparent friendly fire incident,"" but all six crew members ejected safely.
Iran strikes the American embassy in Saudi Arabia.
March 3
Six U.S. soldiers are reported to have died when an ""unmanned aircraft system"" evaded air defenses to hit a command centre in Port Shuaiba, Kuwait. These are the first American troops killed in the Iran War.
Trump orders Treasury Secretary Bessent to ""cut off all dealings"" with Spain, after Spain refuses to grant the U.S. permission to use jointly operated bases to continue its attacks in Iran.
March 4 – DOD Secretary Hegseth announces that a U.S. submarine has sunk an Iranian naval frigate in the Indian Ocean with a single Mark 48 torpedo, the first such sinking of an enemy ship since World War II. The Sri Lankan navy reports the IRIS Dena went down in the Indian Ocean, with 140 people on board missing.
The U.S. House Ethics Committee launched a formal investigation into Tony Gonzales.
March 4–5 – The Senate and House of Representatives reject War Powers Resolutions to halt Trump's actions in the 2026 Iran War without congressional approval.
March 5–17 – The 2026 World Baseball Classic is held in the United States, including Puerto Rico, as well as in Japan. The championship game is held at LoanDepot Park in Miami.
March 5
Trump appoints DHS Secretary Noem as the ""Special Envoy for The Shield of the Americas,"" a security initiative focusing on the Western Hemisphere. Trump nominates U.S. Senator Markwayne Mullin to replace Noem as DHS Secretary.
The Pentagon officially designates artificial intelligence company Anthropic a supply chain risk – the first time the government has given this label to a domestic firm. Anthropic states it will challenge the decision in court.
March 6 – Virginia passes legislation to prohibit schools from teaching about falsehoods of the January 6 United States Capitol attack.
March 7 – Trump hosts the first Shield of the Americas summit in Doral, Florida, with 12 Latin American countries in attendance.
Mach 10 – U.S. federal judge Sarah D. Morrison rules that the prediction market Kalshi constitutes as gambling and must adhere to state gambling regulations.
March 11 – 2026 Minab school attack: A preliminary inquiry finds that the U.S. is at fault for an airstrike which killed 168–180 people at a girls' only elementary school of in Minab, Iran.
March 12
Temple Israel synagogue attack: A suspected attacker is killed after a vehicle rams into a synagogue in West Bloomfield, Michigan, and travels ""with purpose down the hall of the building"".
2026 Old Dominion University shooting: A former National Guardsman opens fire at an ROTC class at Old Dominion University in Norfolk, Virginia, killing the instructor and injuring two cadets. Cadets subdue the shooter, with one fatally stabbing him.
CNN reports that the Pentagon and National Security Council significantly underestimated Iran's willingness to close the Strait of Hormuz in response to U.S. military strikes while planning the ongoing operation.
March 13
The Trump administration announces an expanded trade probe and investigations into Canada and 60 other countries.
NBC News reports that an additional 5,000 U.S. troops along with more warships are to be deployed to the Middle East, following a request by CENTCOM.
March 14 – Trump announces that U.S. forces have ""totally obliterated"" all military targets on Kharg Island, which handles the vast majority of Iran's oil exports.
March 15 – The 98th Academy Awards are held at the Dolby Theatre in Los Angeles, honoring the best films released in 2025. One Battle After Another wins the Academy Award for Best Picture.
March 16
A federal judge blocks the CDC's Advisory Committee on Immunization Practices changes to vaccine policy, including revisions to the childhood immunization schedule. The judge rules that the policy changes were arbitrary and capricious and that HHS Secretary Kennedy illegally fired and replaced committee members.
Trump urges allied countries to assist in securing and reopening the Strait of Hormuz following its effective closure by Iran.
March 17
Joe Kent resigns as director of the National Counterterrorism Center, citing disagreement over American involvement in the Iran war.
Trump criticizes NATO and other U.S. allies, saying he's been told they ""don't want to get involved"" in the Iran war.
Arizona Attorney General Kris Mayes files the first criminal charges against Kalshi, alleging that the prediction market is hosting illegal gambling and breaking state law by betting on elections.
March 18
2026 Minab school attack: Win Without War protestors display children's backpacks on Capitol Hill in protest of Minab elementary school airstrike that killed 160 children. Several Democrats from Congress attend the protest.
The highest March temperature ever recorded in the U.S. occurs, reaching 109 °F (43 °C) near Martinez Lake, Arizona, amid a particularly strong heatwave across the south and southwest. The record is broken again on March 20, reaching 112 °F (44.4 °C).
March 19 – The Pentagon seeks $200 billion in additional funds for the Iran War.
March 20
A jury in California rules that Elon Musk misled Twitter investors before his $44bn purchase of the company in 2022.
A Nevada court rules that Kalshi cannot operate in the state without obtaining a gaming license from the Nevada Gaming Commission.
March 21
Trump issues a warning that if Iran does not fully reopen the Strait of Hormuz within 48 hours, Washington will ""hit and obliterate"" the country's power plants, starting with the largest.
An anti-war protest is held in Philadelphia to call for U.S. Senators John Fetterman and Dave McCormick to bring an end to the war.
In the NCAA Tournament, 11th seed Texas upsets 3rd seed Gonzaga in the Round of 32 to reach the Sweet Sixteen, becoming the first team to go from the First Four to the Sweet Sixteen since the UCLA Bruins did so in 2021.
March 22 – Air Canada Express Flight 8646: Two pilots are killed and more than 40 passengers injured when a Bombardier CRJ700 collides with a firetruck while attempting to cross a runway at LaGuardia Airport, New York.
March 23
Trump announces a postponement of U.S. strikes against Iranian power plants after what he calls ""productive"" negotiations. However, Iran's foreign ministry denies that such talks have taken place.
2026 United States federal government shutdowns: ICE agents are sent to airports to assist TSA agents who are without pay.
A jury in California finds that Bill Cosby is liable for raping a woman by the name of Donna Motsinger in 1972 and awards $19 million in damages to her.
The Trump administration announces that it will pay $1 billion to French company TotalEnergies to cancel planned offshore wind farms in the Atlantic and instead pursue fossil fuel projects.
March 24
The U.S. Senate confirms Markwayne Mullin as the 9th DHS Secretary in a 54–45 vote. Secretary Mullin is the first member of the Cherokee Nation to serve in the U.S. Cabinet.
Former Kentucky Governor Matt Bevin is held in contempt of court and is sentenced to either 60 days in prison or a $500 fine.
Democrat Emily Gregory wins a special election to represent the 87th House district of Florida which contains Mar-a-Lago.
March 25
Expansion of the NBA: The National Basketball Association Board of Governors approve a vote to explore expansion bids in Las Vegas and Seattle.
A jury in California finds that Meta and YouTube are liable for social media addiction.
Iran dismisses a peace plan proposed by the U.S., calling the demands ""excessive"". The White House warns Iran that Donald Trump will ""ensure they are hit harder than ever before"" if the country refuses to accept defeat.
The U.S. Supreme Court unanimously holds that internet service providers are not liable for the copyright infringement of their users if the ISP did not intend its services to be used for infringement.
Trump signs an executive order requiring proof of U.S. citizenship for voter registration.
March 26
Nicolás Maduro and his wife Cilia Flores appear in a New York federal court for their latest hearing, faced with charges of narcoterrorism and weapons offenses.
Treasury Secretary Bessent announces that Trump's signature will appear on U.S. paper currency, the first time a sitting president's signature will appear instead of the Treasurer and Secretary of the Treasury.
March 27
A House Ethics Committee panel finds that Florida Democratic Representative Sheila Cherfilus-McCormick committed ethics violations in misappropriating federal disaster money for her re-election campaign.
A federal appeals court overturns a $16.1billion judgment against Argentina over their nationalization of oil firm YPF.
March 28
Protests against Donald Trump: The third No Kings protests are held in all 50 U.S. states against the policies of Trump and his administration including the Iran war, ICE operations, and the January shootings of Renée Good and Alex Pretti.
In the NCAA Tournament, the Arizona Wildcats reach the Final Four for the first time since 2001. Additionally, Illinois reaches the Final Four for the first time since 2005.
3,500 U.S. troops arrive in the Middle East with the USS Tripoli (LHA-7), as strikes between Israel and Iran continue.
March 30 – Trump and his son Eric unveil the plans for Trump's presidential library in Miami, Florida, at the Miami Dade College campus.⁠ Trump plans for the library to also be a hotel.
March 31
AAA reports the average price of gas in the United States has risen to $4 a gallon for the first time since 2022.
Trump signs an executive order directing DHS to create voter lists and USPS to mail ballots only to people on the list.
A federal judge rules that Trump's Executive Order 14290 barring federal funding for NPR and PBS violates the First Amendment.⁠
The U.S. Supreme Court rules 8–1 that talk therapy used in conversion therapy is protected speech under the First Amendment and orders lower courts to apply strict scrutiny to a Colorado law banning conversion therapy on minors. This ruling potentially strikes down existing restrictions on conversion therapy in the U.S.

April
April 1
Trump says  US military action in Iran could end in ""two to three weeks"", and that the US will ""leave whether we have a deal or not"" once he's certain Iran cannot build a nuclear weapon ""for years"".
NASA launches the Artemis II lunar flyby mission from the Kennedy Space Center in Florida, the first crewed flight beyond low Earth orbit since Apollo 17 in 1972. With a crew of four astronauts – Reid Wiseman (Commander) Victor Glover (Pilot), Christina Koch (Mission specialist), and Canadian astronaut Jeremy Hansen (Mission specialist) – it also becomes the first time a person of color, a woman, and a non-United States citizen have left low Earth orbit.
The Supreme Court hears oral arguments over the constitutionality of Trump's Executive Order 14160 ending birthright citizenship. Trump is in attendance, a first for a sitting president.
The DOJ publishes an opinion that the Presidential Records Act is an unconstitutional overreach of congressional power, and advises Trump that he can refuse to hand over records to the National Archives and Records Administration at the end of his term.
April 2
Trump fires Attorney General Pam Bondi, who is replaced by Todd Blanche in an acting capacity.
Defense Secretary Hegseth fires three high-ranking U.S. Army generals: Chief Staff Randy George, Chief of Chaplins William Green Jr., and T2COM Commander David Hodne. The Pentagon did not provide a reason.
The Colorado Court of Appeals vacates the nine-year sentence of 2020 election denier Tina Peters on First Amendment free speech grounds and remands the case for resentencing.
April 3 – A United States Air Force F-15E Strike Eagle is shot down over Iran during combat operations. Both crew members are later rescued. During the rescue mission, an A-10 Thunderbolt II is also hit and crashes, though its pilot ejects safely and is recovered.
April 4 – 2025–26 NHL season: In ice hockey, the Buffalo Sabres clinched the Stanley Cup playoffs for the first time since the 2010–11 season, ending their 14-year Stanley Cup playoff drought.
April 5
Trump posts an expletive-laden message on Truth Social threatening to destroy Iranian power plants and bridges if Iran does not reopen the Strait of Hormuz, writing: ""Open the Fuckin' Strait, you crazy bastards, or you'll be living in Hell – JUST WATCH!""
The 2026 NCAA Division I women's basketball championship game is held at the Mortgage Matchup Center in Phoenix, Arizona, in which the UCLA Bruins beat the South Carolina Gamecocks 79–51 to win their first title.
April 6
The crew of Artemis II breaks the record for the furthest humans have ever been from Earth, reaching a maximum distance of 252,757 miles (406,773 km) as they travel around the far side of the Moon.
The Supreme Court vacates a federal appeals court ruling that upheld former Trump advisor Steve Bannon's criminal conviction for contempt of Congress for defying a subpoena from the January 6th Committee. The DOJ moves to formally dismiss Bannon's convictions.
The 2026 NCAA Division I men's basketball championship game is held at Lucas Oil Stadium in Indianapolis, in which the Michigan Wolverines beat the UConn Huskies 69–63 to win their second title and first since 1989.
April 7
Iran War:
Trump warns that ""a whole civilization will die tonight, never to be brought back again"" unless Iran reaches a deal on reopening the Strait of Hormuz, and sets a deadline of 20:00 EDT.
Following Trump's threat to ""end its civilization"", Democrats and former Republican congresswoman Marjorie Taylor Greene call for the invocation of the 25th amendment of the United States Constitution. Additionally, Democrats call for Trump to be impeached.
Trump announces a two-week ceasefire that was mediated via Pakistan. He agrees to ""suspend the bombing and attacks on Iran for a period of two weeks"", subject to Iran agreeing to the ""complete, immediate and safe opening"" of the Strait of Hormuz, and to allow time for an agreement to be reached.
Assistant District Attorney Clay Fuller, a Trump-endorsed Republican, wins the special election in Georgia to replace Marjorie Taylor Greene, who resigned in January following a public fallout with Trump.
Judge Chris Taylor, the Democratic-backed candidate, wins election to the Wisconsin Supreme Court. The result expands the court's liberal majority to 5–2.
AI firm Anthropic announces a new model for its Claude language model, named Mythos, designed for locating cybersecurity vulnerabilities and debugging.
April 8
Trump threatens 50% tariffs on countries who distribute weapons to Iran.
Gilgo Beach serial killings: Rex Heuermann pleas guilty to killing eight women between 1993 and 2010 on Long Island.
Jasveen Sangha is sentenced to 15 years in federal prison for distributing ketamine that resulted in the death of Friends actor Matthew Perry in 2023.
April 9
The DNC votes against a resolution to limit AIPAC influence.
Melania Trump delivers a rare public statement at the White House denying any connection to Jeffrey Epstein and his associate Ghislaine Maxwell. She calls allegations linking her to Epstein ""lies"" and urges Congress to hold public hearings for survivors of Epstein's sex trafficking.
The FBI launches an antitrust investigation into the NFL.
April 10
Iran War: U.S. inflation rises to 3.3% year-on-year in March, a two-year high, driven by higher energy and goods prices linked to disruptions caused by the Iran War.
Artemis II successfully returns to Earth, splashing down safely in the Pacific Ocean near San Diego. The four crew members are extracted from the capsule and taken by helicopter to the USS John P Murtha.
April 11
Iran and the United States hold ceasefire talks in Islamabad, Pakistan, making it the first highest-level engagement between the two countries since the Iranian Revolution in 1979. The U.S. delegation is led by Vance.
The U.S. Central Command has confirmed that the U.S. Navy Arleigh Burke-class destroyers USS Frank Peterson and USS Michael Murphy have crossed the Strait of Hormuz to ensure the strait is clear of sea mines.
A  probe against Eric Swalwell over the sexual assault allegations against him is launched by the Manhattan District Attorney.
April 12
Rory McIlroy wins the Masters Tournament for the second straight year, the first golfer to do so since Tiger Woods in 2001–02.
Eric Swalwell suspends his California gubernatorial campaign after four women accuse him of sexual assault and harassment.
April 13
The United States begins a naval blockade of Iran amid the Strait of Hormuz crisis.
Eric Swalwell (D-CA14) and Tony Gonzales (R-TX23) resign from Congress following sexual misconduct allegations.
A federal judge dismisses Trump's $10 billion defamation lawsuit against The Wall Street Journal over articles linking him to Jeffrey Epstein's birthday book because Trump failed to plausibly allege ""actual malice"".
April 15 – John Eastman is disbarred in California for his role in attempting to overturn the 2020 presidential election.
April 16
Justin Fairfax, the former Lieutenant Governor of Virginia (2018–2022), murders his wife Cerina while their two kids are present, before committing suicide.
The Trump administration cancels $73M funding for New York for failing to vet foreign truck drivers.
The DOJ opens an investigation against Eric Swalwell.
Singer D4vd is arrested as the main suspect of the death of Celeste Rivas Hernandez.
The U.S. complete the withdrawal of their armed forces from Syria after being in the country since 2014.
April 17
A federal appeals court allows the Trump administration to continue construction on the White House ballroom until at least June, in response to a lower court injunction ruling that the president requires congressional approval for the ballroom.
Liz Conmy, a member of the North Dakota House of Representatives, dies in a plane crash in Brooklyn Park, Minnesota.
April 18 – Reactions to the Iran War: During the Coachella festival, The Strokes denounce the US-Israel strikes against Iran and accuse the Central Intelligence Agency of using violence to promote regime change while performing Oblivius.
April 19 – Eight children are killed and two other people are injured in a mass shooting at multiple locations in Shreveport, Louisiana. The perpetrator is killed by police.
April 20
Labor Secretary Lori Chavez-DeRemer resigns amid abuse of power allegations. Keith E. Sonderling becomes Acting Secretary of Labor.
Around 62 U.S. military veterans are arrested by the U.S. Capitol Police inside the United States Capitol in Washington, DC during a protest against the Iran War after occupying the Cannon House Office Building. Among those arrested are Center on Conscience & War executive director Mike Prysner and client Tyler Romero.
The Onion implements a new plan to acquire InfoWars from far-right conspiracy theorist Alex Jones after an earlier plan was rejected by a judge.
Tim Cook announces he will step down as Apple's CEO and become Executive Director. John Ternus is chosen as Apple's next CEO, effective September 1, 2026.
FBI Director Kash Patel sues The Atlantic in a $250 million defamation lawsuit over an article claiming that Patel is an alcoholic.
April 21
Trump says that he extended the Iran truce to allow time for an Iranian proposal to be submitted at Pakistan's request.
2026 Virginia redistricting amendment: Voters in Virginia approve a redistricting referendum aimed at boosting Democrats' chance of winning seats in the upcoming midterms.
The DOJ charges the Southern Poverty Law Center with defrauding donors with payments to white nationalist informants.
April 22 – A chemical accident in Institute, West Virginia leaves two dead and 30 others injured.
April 23
Trump orders the US Navy to destroy any Iranian boats laying mines in the Hormuz.
Acting Attorney General Blanche reclassifies marijuana to a Schedule III drug.
Warner Bros. Discovery shareholders approve Paramount Skydance's proposed acquisition of the company in a deal valued at $111 billion including debt, moving the merger a step closer to completion pending regulatory approval.
A shooting at the Mall of Louisiana in Baton Rouge leaves five injured and one dead.
April 24 – Trump fires all 24 members of the National Science Board, the body that oversees the National Science Foundation.

April 25
Trump is evacuated after a shooting occurs at the White House Correspondents' Dinner. One law enforcement officer is struck in a bullet-resistant vest and is expected to recover. A 31-year-old male suspect is subdued and taken into custody.
The US military announces that its strike on an alleged drug boat in the eastern Pacific killed two people.
April 26 – 2026 NASCAR Cup Series: In NASCAR, a 26-car pileup occurs during the Jack Link's 500 at the Talladega Superspeedway after driver Bubba Wallace was pushed from outside.
April 27
The suspect in the White House Correspondents' Dinner shooting is charged with attempting to assassinate the president, along with weapon offences relating to the incident at the Washington DC Hilton. He does not enter a plea.
King Charles and Queen Camilla arrive in the US for a state visit.
April 28 – Former FBI director James Comey is indicted on federal charges of threatening the president. The charges are related to a post he made in May 2025, which included a photo of seashells on the beach arranged to spell ""86 47"".
April 29
The Washington Post reports that the USS Gerald R. Ford will exit the Middle East and return to Virginia in the coming days after spending 10 months at sea.
Louisiana v. Callais: The Supreme Court, in a 6–3 decision, rules that Louisiana's new redistricting map was an unconstitutional racial gerrymander under the Fifteenth Amendment.
April 30
Camp Mystic in Texas withdraws an application to reopen during the summer in the wake of the floods in July 2025.
Trump signs a bill to fund the Department of Homeland Security, the Secret Service, the Coast Guard, FEMA, TSA, and the Cybersecurity and Infrastructure Security Agency, ending a 76-day partial government shutdown.
In ice hockey, the Minnesota Wild defeat the Dallas Stars in six games in the 2026 Stanley Cup playoffs following a 5–2 victory to win a playoff series for the first time since 2015, ending an 11-year drought.

May
May 1
Iran War: President Donald Trump notifies lawmakers in Congress that the Iran war has been ""terminated"" ahead of a 60-day deadline under the War Powers Resolution which military operations must halt unless lawmakers authorize military force.
2026 May Day protests: May Day protests are held across the U.S., including an economic blackout as part of 3,500 ""May Day Strong"" events across the country. Additionally, demonstrations are held outside institutions such as the New York Stock Exchange.
British singer Zayn Malik cancels all U.S. concert events for his upcoming Konnakol tour after being hospitalized for an unknown illness.
May 2
2026 Kentucky Derby: In horse racing, American racehorse Golden Tempo wins the 152nd Kentucky Derby after entering the race with a 24–1 odds, making Cherie DeVaux the first female trainer to win the derby.
Spirit Airlines announces it has gone out of business after 34 years.
May 3 – Iran War: President Trump announces Operation Project Freedom in an effort to secure commercial traffic across the Strait of Hormuz.
May 4
Iran War:
The U.S. Central Command confirms the launch of Operation Project Freedom in an effort to secure commercial traffic across the Strait of Hormuz.
Danish shipping company Maersk reports that the Alliance Fairfax, a US-flagged vehicle carrier operated by subsidiary Farrell Lines, has successfully crossed the Strait of Hormuz accompanied by U.S. military assets as part of Project Freedom.
Iran is reported to have fired missiles and drones at military and commercial ships.
